log_db_prune_main/database_tuning_record.json
[0,[[[["GetBlock",[],["pad_temp","main"],["b0"]],["GetBlock",[],["conv2d_nchw","main"],["b1"]],["GetBlock",[],["T_add","main"],["b2"]],["GetBlock",[],["T_add_1","main"],["b3"]],["GetBlock",[],["root","main"],["b4"]],["Annotate",["b1","\"SSSRRSRS\""],["meta_schedule.tiling_structure"],[]],["GetLoops",["b1"],[],["l5","l6","l7","l8","l9","l10","l11"]],["SamplePerfectTile",["l5"],[5,64],["v12","v13","v14","v15","v16"]],["Split",["l5","v12","v13","v14","v15","v16"],[1],["l17","l18","l19","l20","l21"]],["SamplePerfectTile",["l6"],[5,64],["v22","v23","v24","v25","v26"]],["Split",["l6","v22","v23","v24","v25","v26"],[1],["l27","l28","l29","l30","l31"]],["SamplePerfectTile",["l7"],[5,64],["v32","v33","v34","v35","v36"]],["Split",["l7","v32","v33","v34","v35","v36"],[1],["l37","l38","l39","l40","l41"]],["SamplePerfectTile",["l8"],[5,64],["v42","v43","v44","v45","v46"]],["Split",["l8","v42","v43","v44","v45","v46"],[1],["l47","l48","l49","l50","l51"]],["SamplePerfectTile",["l9"],[3,64],["v52","v53","v54"]],["Split",["l9","v52","v53","v54"],[1],["l55","l56","l57"]],["SamplePerfectTile",["l10"],[3,64],["v58","v59","v60"]],["Split",["l10","v58","v59","v60"],[1],["l61","l62","l63"]],["SamplePerfectTile",["l11"],[3,64],["v64","v65","v66"]],["Split",["l11","v64","v65","v66"],[1],["l67","l68","l69"]],["Reorder",["l17","l27","l37","l47","l18","l28","l38","l48","l19","l29","l39","l49","l55","l61","l67","l56","l62","l68","l20","l30","l40","l50","l57","l63","l69","l21","l31","l41","l51"],[],[]],["Fuse",["l17","l27","l37","l47"],[1],["l70"]],["Bind",["l70"],["blockIdx.x"],[]],["Fuse",["l18","l28","l38","l48"],[1],["l71"]],["Bind",["l71"],["vthread.x"],[]],["Fuse",["l19","l29","l39","l49"],[1],["l72"]],["Bind",["l72"],["threadIdx.x"],[]],["Annotate",["b1",32],["meta_schedule.thread_extent_low_inclusive"],[]],["Annotate",["b1",256],["meta_schedule.thread_extent_high_inclusive"],[]],["CacheWrite",["b1",[]],[0,"local"],["b73"]],["ReverseComputeAt",["b73","l72"],[1,-1],[]],["CacheRead",["b1",["b1"]],[0,"shared"],["b74"]],["ComputeAt",["b74","l67"],[1,-1],[]],["GetLoops",["b74"],[],["l75","l76","l77","l78","l79","l80","l81","l82","l83","l84"]],["Fuse",["l81","l82","l83","l84"],[1],["l85"]],["SampleCategorical",[],[[1,2,3,4],[0.25,0.25,0.25,0.25]],["v86"]],["Annotate",["b74","v86"],["meta_schedule.cooperative_fetch"],[]],["CacheRead",["b1",["b1"]],[1,"shared"],["b87"]],["ComputeAt",["b87","l67"],[1,-1],[]],["GetLoops",["b87"],[],["l88","l89","l90","l91","l92","l93","l94","l95","l96","l97"]],["Fuse",["l94","l95","l96","l97"],[1],["l98"]],["SampleCategorical",[],[[1,2,3,4],[0.25,0.25,0.25,0.25]],["v99"]],["Annotate",["b87","v99"],["meta_schedule.cooperative_fetch"],[]],["ReverseComputeInline",["b3"],[],[]],["ReverseComputeInline",["b2"],[],[]],["ComputeInline",["b0"],[],[]],["SampleCategorical",[],[[0,16,64,512,1024],[0.2000000000000000111,0.2000000000000000111,0.2000000000000000111,0.2000000000000000111,0.2000000000000000111]],["v100"]],["Annotate",["b4","v100"],["meta_schedule.unroll_explicit"],[]],["EnterPostproc",[],[],[]],["Unannotate",["b74"],["meta_schedule.cooperative_fetch"],[]],["GetLoops",["b74"],[],["l101","l102","l103","l104","l105","l106","l107"]],["Split",["l107","None",128,4],[1],["l108","l109","l110"]],["Vectorize",["l110"],[],[]],["Bind",["l109"],["threadIdx.x"],[]],["Unannotate",["b87"],["meta_schedule.cooperative_fetch"],[]],["GetLoops",["b87"],[],["l111","l112","l113","l114","l115","l116","l117"]],["Split",["l117","None",128,3],[1],["l118","l119","l120"]],["Vectorize",["l120"],[],[]],["Bind",["l119"],["threadIdx.x"],[]],["GetBlock",[],["root","main"],["b121"]],["Unannotate",["b121"],["meta_schedule.unroll_explicit"],[]],["GetChildBlocks",["b121"],[],["b122","b123","b124","b125"]],["GetLoops",["b122"],[],["l126","l127","l128","l129","l130","l131","l132","l133","l134"]],["GetLoops",["b123"],[],["l135","l136","l137","l138","l139","l140","l141","l142","l143"]],["GetLoops",["b124"],[],["l144","l145","l146","l147","l148","l149","l150","l151","l152","l153","l154","l155","l156","l157","l158","l159","l160","l161","l162","l163"]],["GetLoops",["b125"],[],["l164","l165","l166","l167","l168","l169","l170"]],["GetBlock",[],["conv2d_nchw","main"],["b171"]],["GetLoops",["b171"],[],["l172","l173","l174","l175","l176","l177","l178","l179","l180","l181","l182","l183","l184","l185","l186","l187","l188","l189","l190","l191"]],["DecomposeReduction",["b171","l175"],[],["b192"]]],[[7,[1,1,1,2,1]],[9,[20,1,8,4,1]],[11,[16,2,2,1,1]],[13,[4,1,8,2,1]],[15,[240,8,1]],[17,[1,3,1]],[19,[1,1,3]],[36,3],[42,2],[47,0]]],[0.023887974999999998793],{"host":{"keys":["arm_cpu","cpu"],"kind":"llvm","mcpu":"apple-latest","mtriple":"arm64-apple-macos","tag":""},"keys":["metal","gpu"],"kind":"metal","max_function_args":31,"max_num_threads":256,"max_shared_memory_per_block":32768,"max_threads_per_block":256,"tag":"","thread_warp_size":32},[["TENSOR","float32",[2,1920,64,64]],["TENSOR","float32",[640,1920,3,3]],["TENSOR","float32",[1,640,1,1]],["TENSOR","float32",[2,640,1,1]],["TENSOR","float32",[2,640,64,64]]]]]
[1,[[[["GetBlock",[],["pad_temp","main"],["b0"]],["GetBlock",[],["conv2d_nchw","main"],["b1"]],["GetBlock",[],["T_add","main"],["b2"]],["GetBlock",[],["T_add_1","main"],["b3"]],["GetBlock",[],["root","main"],["b4"]],["Annotate",["b1","\"SSSRRSRS\""],["meta_schedule.tiling_structure"],[]],["GetLoops",["b1"],[],["l5","l6","l7","l8","l9","l10","l11"]],["SamplePerfectTile",["l5"],[5,64],["v12","v13","v14","v15","v16"]],["Split",["l5","v12","v13","v14","v15","v16"],[1],["l17","l18","l19","l20","l21"]],["SamplePerfectTile",["l6"],[5,64],["v22","v23","v24","v25","v26"]],["Split",["l6","v22","v23","v24","v25","v26"],[1],["l27","l28","l29","l30","l31"]],["SamplePerfectTile",["l7"],[5,64],["v32","v33","v34","v35","v36"]],["Split",["l7","v32","v33","v34","v35","v36"],[1],["l37","l38","l39","l40","l41"]],["SamplePerfectTile",["l8"],[5,64],["v42","v43","v44","v45","v46"]],["Split",["l8","v42","v43","v44","v45","v46"],[1],["l47","l48","l49","l50","l51"]],["SamplePerfectTile",["l9"],[3,64],["v52","v53","v54"]],["Split",["l9","v52","v53","v54"],[1],["l55","l56","l57"]],["SamplePerfectTile",["l10"],[3,64],["v58","v59","v60"]],["Split",["l10","v58","v59","v60"],[1],["l61","l62","l63"]],["SamplePerfectTile",["l11"],[3,64],["v64","v65","v66"]],["Split",["l11","v64","v65","v66"],[1],["l67","l68","l69"]],["Reorder",["l17","l27","l37","l47","l18","l28","l38","l48","l19","l29","l39","l49","l55","l61","l67","l56","l62","l68","l20","l30","l40","l50","l57","l63","l69","l21","l31","l41","l51"],[],[]],["Fuse",["l17","l27","l37","l47"],[1],["l70"]],["Bind",["l70"],["blockIdx.x"],[]],["Fuse",["l18","l28","l38","l48"],[1],["l71"]],["Bind",["l71"],["vthread.x"],[]],["Fuse",["l19","l29","l39","l49"],[1],["l72"]],["Bind",["l72"],["threadIdx.x"],[]],["Annotate",["b1",32],["meta_schedule.thread_extent_low_inclusive"],[]],["Annotate",["b1",256],["meta_schedule.thread_extent_high_inclusive"],[]],["CacheWrite",["b1",[]],[0,"local"],["b73"]],["ReverseComputeAt",["b73","l72"],[1,-1],[]],["CacheRead",["b1",["b1"]],[0,"shared"],["b74"]],["ComputeAt",["b74","l67"],[1,-1],[]],["GetLoops",["b74"],[],["l75","l76","l77","l78","l79","l80","l81","l82","l83","l84"]],["Fuse",["l81","l82","l83","l84"],[1],["l85"]],["SampleCategorical",[],[[1,2,3,4],[0.25,0.25,0.25,0.25]],["v86"]],["Annotate",["b74","v86"],["meta_schedule.cooperative_fetch"],[]],["CacheRead",["b1",["b1"]],[1,"shared"],["b87"]],["ComputeAt",["b87","l67"],[1,-1],[]],["GetLoops",["b87"],[],["l88","l89","l90","l91","l92","l93","l94","l95","l96","l97"]],["Fuse",["l94","l95","l96","l97"],[1],["l98"]],["SampleCategorical",[],[[1,2,3,4],[0.25,0.25,0.25,0.25]],["v99"]],["Annotate",["b87","v99"],["meta_schedule.cooperative_fetch"],[]],["ReverseComputeInline",["b3"],[],[]],["ReverseComputeInline",["b2"],[],[]],["ComputeInline",["b0"],[],[]],["SampleCategorical",[],[[0,16,64,512,1024],[0.2000000000000000111,0.2000000000000000111,0.2000000000000000111,0.2000000000000000111,0.2000000000000000111]],["v100"]],["Annotate",["b4","v100"],["meta_schedule.unroll_explicit"],[]],["EnterPostproc",[],[],[]],["Unannotate",["b74"],["meta_schedule.cooperative_fetch"],[]],["GetLoops",["b74"],[],["l101","l102","l103","l104","l105","l106","l107"]],["Split",["l107","None",160,2],[1],["l108","l109","l110"]],["Vectorize",["l110"],[],[]],["Bind",["l109"],["threadIdx.x"],[]],["Unannotate",["b87"],["meta_schedule.cooperative_fetch"],[]],["GetLoops",["b87"],[],["l111","l112","l113","l114","l115","l116","l117"]],["Split",["l117","None",160,3],[1],["l118","l119","l120"]],["Vectorize",["l120"],[],[]],["Bind",["l119"],["threadIdx.x"],[]],["GetBlock",[],["root","main"],["b121"]],["Unannotate",["b121"],["meta_schedule.unroll_explicit"],[]],["GetChildBlocks",["b121"],[],["b122","b123","b124","b125"]],["GetLoops",["b122"],[],["l126","l127","l128","l129","l130","l131","l132","l133","l134"]],["GetLoops",["b123"],[],["l135","l136","l137","l138","l139","l140","l141","l142","l143"]],["GetLoops",["b124"],[],["l144","l145","l146","l147","l148","l149","l150","l151","l152","l153","l154","l155","l156","l157","l158","l159","l160","l161","l162","l163"]],["Annotate",["l144",512],["pragma_auto_unroll_max_step"],[]],["Annotate",["l144",1],["pragma_unroll_explicit"],[]],["GetLoops",["b125"],[],["l164","l165","l166","l167","l168","l169","l170"]],["GetBlock",[],["conv2d_nchw","main"],["b171"]],["GetLoops",["b171"],[],["l172","l173","l174","l175","l176","l177","l178","l179","l180","l181","l182","l183","l184","l185","l186","l187","l188","l189","l190","l191"]],["DecomposeReduction",["b171","l175"],[],["b192"]]],[[7,[2,1,1,1,1]],[9,[16,4,20,1,1]],[11,[4,1,2,4,1]],[13,[4,1,4,1,2]],[15,[512,5,1]],[17,[1,3,1]],[19,[1,3,1]],[36,1],[42,2],[47,3]]],[0.013284687499999999621],{"host":{"keys":["arm_cpu","cpu"],"kind":"llvm","mcpu":"apple-latest","mtriple":"arm64-apple-macos","tag":""},"keys":["metal","gpu"],"kind":"metal","max_function_args":31,"max_num_threads":256,"max_shared_memory_per_block":32768,"max_threads_per_block":256,"tag":"","thread_warp_size":32},[["TENSOR","float32",[2,2560,32,32]],["TENSOR","float32",[1280,2560,3,3]],["TENSOR","float32",[1,1280,1,1]],["TENSOR","float32",[2,1280,1,1]],["TENSOR","float32",[2,1280,32,32]]]]]
[2,[[[["GetBlock",[],["pad_temp","main"],["b0"]],["GetBlock",[],["conv2d_nchw","main"],["b1"]],["GetBlock",[],["T_add","main"],["b2"]],["GetBlock",[],["T_add_1","main"],["b3"]],["GetBlock",[],["root","main"],["b4"]],["Annotate",["b1","\"SSSRRSRS\""],["meta_schedule.tiling_structure"],[]],["GetLoops",["b1"],[],["l5","l6","l7","l8","l9","l10","l11"]],["SamplePerfectTile",["l5"],[5,64],["v12","v13","v14","v15","v16"]],["Split",["l5","v12","v13","v14","v15","v16"],[1],["l17","l18","l19","l20","l21"]],["SamplePerfectTile",["l6"],[5,64],["v22","v23","v24","v25","v26"]],["Split",["l6","v22","v23","v24","v25","v26"],[1],["l27","l28","l29","l30","l31"]],["SamplePerfectTile",["l7"],[5,64],["v32","v33","v34","v35","v36"]],["Split",["l7","v32","v33","v34","v35","v36"],[1],["l37","l38","l39","l40","l41"]],["SamplePerfectTile",["l8"],[5,64],["v42","v43","v44","v45","v46"]],["Split",["l8","v42","v43","v44","v45","v46"],[1],["l47","l48","l49","l50","l51"]],["SamplePerfectTile",["l9"],[3,64],["v52","v53","v54"]],["Split",["l9","v52","v53","v54"],[1],["l55","l56","l57"]],["SamplePerfectTile",["l10"],[3,64],["v58","v59","v60"]],["Split",["l10","v58","v59","v60"],[1],["l61","l62","l63"]],["SamplePerfectTile",["l11"],[3,64],["v64","v65","v66"]],["Split",["l11","v64","v65","v66"],[1],["l67","l68","l69"]],["Reorder",["l17","l27","l37","l47","l18","l28","l38","l48","l19","l29","l39","l49","l55","l61","l67","l56","l62","l68","l20","l30","l40","l50","l57","l63","l69","l21","l31","l41","l51"],[],[]],["Fuse",["l17","l27","l37","l47"],[1],["l70"]],["Bind",["l70"],["blockIdx.x"],[]],["Fuse",["l18","l28","l38","l48"],[1],["l71"]],["Bind",["l71"],["vthread.x"],[]],["Fuse",["l19","l29","l39","l49"],[1],["l72"]],["Bind",["l72"],["threadIdx.x"],[]],["Annotate",["b1",32],["meta_schedule.thread_extent_low_inclusive"],[]],["Annotate",["b1",256],["meta_schedule.thread_extent_high_inclusive"],[]],["CacheWrite",["b1",[]],[0,"local"],["b73"]],["ReverseComputeAt",["b73","l72"],[1,-1],[]],["CacheRead",["b1",["b1"]],[0,"shared"],["b74"]],["ComputeAt",["b74","l67"],[1,-1],[]],["GetLoops",["b74"],[],["l75","l76","l77","l78","l79","l80","l81","l82","l83","l84"]],["Fuse",["l81","l82","l83","l84"],[1],["l85"]],["SampleCategorical",[],[[1,2,3,4],[0.25,0.25,0.25,0.25]],["v86"]],["Annotate",["b74","v86"],["meta_schedule.cooperative_fetch"],[]],["CacheRead",["b1",["b1"]],[1,"shared"],["b87"]],["ComputeAt",["b87","l67"],[1,-1],[]],["GetLoops",["b87"],[],["l88","l89","l90","l91","l92","l93","l94","l95","l96","l97"]],["Fuse",["l94","l95","l96","l97"],[1],["l98"]],["SampleCategorical",[],[[1,2,3,4],[0.25,0.25,0.25,0.25]],["v99"]],["Annotate",["b87","v99"],["meta_schedule.cooperative_fetch"],[]],["ReverseComputeInline",["b3"],[],[]],["ReverseComputeInline",["b2"],[],[]],["ComputeInline",["b0"],[],[]],["SampleCategorical",[],[[0,16,64,512,1024],[0.2000000000000000111,0.2000000000000000111,0.2000000000000000111,0.2000000000000000111,0.2000000000000000111]],["v100"]],["Annotate",["b4","v100"],["meta_schedule.unroll_explicit"],[]],["EnterPostproc",[],[],[]],["Unannotate",["b74"],["meta_schedule.cooperative_fetch"],[]],["GetLoops",["b74"],[],["l101","l102","l103","l104","l105","l106","l107"]],["Split",["l107","None",64,3],[1],["l108","l109","l110"]],["Vectorize",["l110"],[],[]],["Bind",["l109"],["threadIdx.x"],[]],["Unannotate",["b87"],["meta_schedule.cooperative_fetch"],[]],["GetLoops",["b87"],[],["l111","l112","l113","l114","l115","l116","l117"]],["Split",["l117","None",64,3],[1],["l118","l119","l120"]],["Vectorize",["l120"],[],[]],["Bind",["l119"],["threadIdx.x"],[]],["GetBlock",[],["root","main"],["b121"]],["Unannotate",["b121"],["meta_schedule.unroll_explicit"],[]],["GetChildBlocks",["b121"],[],["b122","b123","b124","b125"]],["GetLoops",["b122"],[],["l126","l127","l128","l129","l130","l131","l132","l133","l134"]],["GetLoops",["b123"],[],["l135","l136","l137","l138","l139","l140","l141","l142","l143"]],["GetLoops",["b124"],[],["l144","l145","l146","l147","l148","l149","l150","l151","l152","l153","l154","l155","l156","l157","l158","l159","l160","l161","l162","l163"]],["Annotate",["l144",16],["pragma_auto_unroll_max_step"],[]],["Annotate",["l144",1],["pragma_unroll_explicit"],[]],["GetLoops",["b125"],[],["l164","l165","l166","l167","l168","l169","l170"]],["GetBlock",[],["conv2d_nchw","main"],["b171"]],["GetLoops",["b171"],[],["l172","l173","l174","l175","l176","l177","l178","l179","l180","l181","l182","l183","l184","l185","l186","l187","l188","l189","l190","l191"]],["DecomposeReduction",["b171","l175"],[],["b192"]]],[[7,[2,1,1,1,1]],[9,[64,5,4,1,1]],[11,[4,1,2,4,1]],[13,[2,1,8,1,2]],[15,[1920,1,1]],[17,[1,1,3]],[19,[1,3,1]],[36,2],[42,2],[47,1]]],[0.012066787000000000693],{"host":{"keys":["arm_cpu","cpu"],"kind":"llvm","mcpu":"apple-latest","mtriple":"arm64-apple-macos","tag":""},"keys":["metal","gpu"],"kind":"metal","max_function_args":31,"max_num_threads":256,"max_shared_memory_per_block":32768,"max_threads_per_block":256,"tag":"","thread_warp_size":32},[["TENSOR","float32",[2,1920,32,32]],["TENSOR","float32",[1280,1920,3,3]],["TENSOR","float32",[1,1280,1,1]],["TENSOR","float32",[2,1280,1,1]],["TENSOR","float32",[2,1280,32,32]]]]]
[3,[[[["GetBlock",[],["pad_temp","main"],["b0"]],["GetBlock",[],["conv2d_nchw","main"],["b1"]],["GetBlock",[],["T_add","main"],["b2"]],["GetBlock",[],["T_add_1","main"],["b3"]],["GetBlock",[],["root","main"],["b4"]],["Annotate",["b1","\"SSSRRSRS\""],["meta_schedule.tiling_structure"],[]],["GetLoops",["b1"],[],["l5","l6","l7","l8","l9","l10","l11"]],["SamplePerfectTile",["l5"],[5,64],["v12","v13","v14","v15","v16"]],["Split",["l5","v12","v13","v14","v15","v16"],[1],["l17","l18","l19","l20","l21"]],["SamplePerfectTile",["l6"],[5,64],["v22","v23","v24","v25","v26"]],["Split",["l6","v22","v23","v24","v25","v26"],[1],["l27","l28","l29","l30","l31"]],["SamplePerfectTile",["l7"],[5,64],["v32","v33","v34","v35","v36"]],["Split",["l7","v32","v33","v34","v35","v36"],[1],["l37","l38","l39","l40","l41"]],["SamplePerfectTile",["l8"],[5,64],["v42","v43","v44","v45","v46"]],["Split",["l8","v42","v43","v44","v45","v46"],[1],["l47","l48","l49","l50","l51"]],["SamplePerfectTile",["l9"],[3,64],["v52","v53","v54"]],["Split",["l9","v52","v53","v54"],[1],["l55","l56","l57"]],["SamplePerfectTile",["l10"],[3,64],["v58","v59","v60"]],["Split",["l10","v58","v59","v60"],[1],["l61","l62","l63"]],["SamplePerfectTile",["l11"],[3,64],["v64","v65","v66"]],["Split",["l11","v64","v65","v66"],[1],["l67","l68","l69"]],["Reorder",["l17","l27","l37","l47","l18","l28","l38","l48","l19","l29","l39","l49","l55","l61","l67","l56","l62","l68","l20","l30","l40","l50","l57","l63","l69","l21","l31","l41","l51"],[],[]],["Fuse",["l17","l27","l37","l47"],[1],["l70"]],["Bind",["l70"],["blockIdx.x"],[]],["Fuse",["l18","l28","l38","l48"],[1],["l71"]],["Bind",["l71"],["vthread.x"],[]],["Fuse",["l19","l29","l39","l49"],[1],["l72"]],["Bind",["l72"],["threadIdx.x"],[]],["Annotate",["b1",32],["meta_schedule.thread_extent_low_inclusive"],[]],["Annotate",["b1",256],["meta_schedule.thread_extent_high_inclusive"],[]],["CacheWrite",["b1",[]],[0,"local"],["b73"]],["ReverseComputeAt",["b73","l72"],[1,-1],[]],["CacheRead",["b1",["b1"]],[0,"shared"],["b74"]],["ComputeAt",["b74","l67"],[1,-1],[]],["GetLoops",["b74"],[],["l75","l76","l77","l78","l79","l80","l81","l82","l83","l84"]],["Fuse",["l81","l82","l83","l84"],[1],["l85"]],["SampleCategorical",[],[[1,2,3,4],[0.25,0.25,0.25,0.25]],["v86"]],["Annotate",["b74","v86"],["meta_schedule.cooperative_fetch"],[]],["CacheRead",["b1",["b1"]],[1,"shared"],["b87"]],["ComputeAt",["b87","l67"],[1,-1],[]],["GetLoops",["b87"],[],["l88","l89","l90","l91","l92","l93","l94","l95","l96","l97"]],["Fuse",["l94","l95","l96","l97"],[1],["l98"]],["SampleCategorical",[],[[1,2,3,4],[0.25,0.25,0.25,0.25]],["v99"]],["Annotate",["b87","v99"],["meta_schedule.cooperative_fetch"],[]],["ReverseComputeInline",["b3"],[],[]],["ReverseComputeInline",["b2"],[],[]],["ComputeInline",["b0"],[],[]],["SampleCategorical",[],[[0,16,64,512,1024],[0.2000000000000000111,0.2000000000000000111,0.2000000000000000111,0.2000000000000000111,0.2000000000000000111]],["v100"]],["Annotate",["b4","v100"],["meta_schedule.unroll_explicit"],[]],["EnterPostproc",[],[],[]],["Unannotate",["b74"],["meta_schedule.cooperative_fetch"],[]],["GetLoops",["b74"],[],["l101","l102","l103","l104","l105","l106","l107"]],["Split",["l107","None",256,3],[1],["l108","l109","l110"]],["Vectorize",["l110"],[],[]],["Bind",["l109"],["threadIdx.x"],[]],["Unannotate",["b87"],["meta_schedule.cooperative_fetch"],[]],["GetLoops",["b87"],[],["l111","l112","l113","l114","l115","l116","l117"]],["Split",["l117","None",256,2],[1],["l118","l119","l120"]],["Vectorize",["l120"],[],[]],["Bind",["l119"],["threadIdx.x"],[]],["GetBlock",[],["root","main"],["b121"]],["Unannotate",["b121"],["meta_schedule.unroll_explicit"],[]],["GetChildBlocks",["b121"],[],["b122","b123","b124","b125"]],["GetLoops",["b122"],[],["l126","l127","l128","l129","l130","l131","l132","l133","l134"]],["GetLoops",["b123"],[],["l135","l136","l137","l138","l139","l140","l141","l142","l143"]],["GetLoops",["b124"],[],["l144","l145","l146","l147","l148","l149","l150","l151","l152","l153","l154","l155","l156","l157","l158","l159","l160","l161","l162","l163"]],["Annotate",["l144",64],["pragma_auto_unroll_max_step"],[]],["Annotate",["l144",1],["pragma_unroll_explicit"],[]],["GetLoops",["b125"],[],["l164","l165","l166","l167","l168","l169","l170"]],["GetBlock",[],["conv2d_nchw","main"],["b171"]],["GetLoops",["b171"],[],["l172","l173","l174","l175","l176","l177","l178","l179","l180","l181","l182","l183","l184","l185","l186","l187","l188","l189","l190","l191"]],["DecomposeReduction",["b171","l175"],[],["b192"]]],[[7,[2,1,1,1,1]],[9,[20,1,4,4,2]],[11,[8,1,4,2,1]],[13,[4,1,16,1,1]],[15,[240,4,1]],[17,[1,1,3]],[19,[1,1,3]],[36,2],[42,1],[47,2]]],[0.011139736111111110672],{"host":{"keys":["arm_cpu","cpu"],"kind":"llvm","mcpu":"apple-latest","mtriple":"arm64-apple-macos","tag":""},"keys":["metal","gpu"],"kind":"metal","max_function_args":31,"max_num_threads":256,"max_shared_memory_per_block":32768,"max_threads_per_block":256,"tag":"","thread_warp_size":32},[["TENSOR","float32",[2,960,64,64]],["TENSOR","float32",[640,960,3,3]],["TENSOR","float32",[1,640,1,1]],["TENSOR","float32",[2,640,1,1]],["TENSOR","float32",[2,640,64,64]]]]]
[4,[[[["GetBlock",[],["pad_temp","main"],["b0"]],["GetBlock",[],["conv2d_nchw","main"],["b1"]],["GetBlock",[],["T_add","main"],["b2"]],["GetBlock",[],["T_add_1","main"],["b3"]],["GetBlock",[],["root","main"],["b4"]],["Annotate",["b1","\"SSSRRSRS\""],["meta_schedule.tiling_structure"],[]],["GetLoops",["b1"],[],["l5","l6","l7","l8","l9","l10","l11"]],["SamplePerfectTile",["l5"],[5,64],["v12","v13","v14","v15","v16"]],["Split",["l5","v12","v13","v14","v15","v16"],[1],["l17","l18","l19","l20","l21"]],["SamplePerfectTile",["l6"],[5,64],["v22","v23","v24","v25","v26"]],["Split",["l6","v22","v23","v24","v25","v26"],[1],["l27","l28","l29","l30","l31"]],["SamplePerfectTile",["l7"],[5,64],["v32","v33","v34","v35","v36"]],["Split",["l7","v32","v33","v34","v35","v36"],[1],["l37","l38","l39","l40","l41"]],["SamplePerfectTile",["l8"],[5,64],["v42","v43","v44","v45","v46"]],["Split",["l8","v42","v43","v44","v45","v46"],[1],["l47","l48","l49","l50","l51"]],["SamplePerfectTile",["l9"],[3,64],["v52","v53","v54"]],["Split",["l9","v52","v53","v54"],[1],["l55","l56","l57"]],["SamplePerfectTile",["l10"],[3,64],["v58","v59","v60"]],["Split",["l10","v58","v59","v60"],[1],["l61","l62","l63"]],["SamplePerfectTile",["l11"],[3,64],["v64","v65","v66"]],["Split",["l11","v64","v65","v66"],[1],["l67","l68","l69"]],["Reorder",["l17","l27","l37","l47","l18","l28","l38","l48","l19","l29","l39","l49","l55","l61","l67","l56","l62","l68","l20","l30","l40","l50","l57","l63","l69","l21","l31","l41","l51"],[],[]],["Fuse",["l17","l27","l37","l47"],[1],["l70"]],["Bind",["l70"],["blockIdx.x"],[]],["Fuse",["l18","l28","l38","l48"],[1],["l71"]],["Bind",["l71"],["vthread.x"],[]],["Fuse",["l19","l29","l39","l49"],[1],["l72"]],["Bind",["l72"],["threadIdx.x"],[]],["Annotate",["b1",32],["meta_schedule.thread_extent_low_inclusive"],[]],["Annotate",["b1",256],["meta_schedule.thread_extent_high_inclusive"],[]],["CacheWrite",["b1",[]],[0,"local"],["b73"]],["ReverseComputeAt",["b73","l72"],[1,-1],[]],["CacheRead",["b1",["b1"]],[0,"shared"],["b74"]],["ComputeAt",["b74","l67"],[1,-1],[]],["GetLoops",["b74"],[],["l75","l76","l77","l78","l79","l80","l81","l82","l83","l84"]],["Fuse",["l81","l82","l83","l84"],[1],["l85"]],["SampleCategorical",[],[[1,2,3,4],[0.25,0.25,0.25,0.25]],["v86"]],["Annotate",["b74","v86"],["meta_schedule.cooperative_fetch"],[]],["CacheRead",["b1",["b1"]],[1,"shared"],["b87"]],["ComputeAt",["b87","l67"],[1,-1],[]],["GetLoops",["b87"],[],["l88","l89","l90","l91","l92","l93","l94","l95","l96","l97"]],["Fuse",["l94","l95","l96","l97"],[1],["l98"]],["SampleCategorical",[],[[1,2,3,4],[0.25,0.25,0.25,0.25]],["v99"]],["Annotate",["b87","v99"],["meta_schedule.cooperative_fetch"],[]],["ReverseComputeInline",["b3"],[],[]],["ReverseComputeInline",["b2"],[],[]],["ComputeInline",["b0"],[],[]],["SampleCategorical",[],[[0,16,64,512,1024],[0.2000000000000000111,0.2000000000000000111,0.2000000000000000111,0.2000000000000000111,0.2000000000000000111]],["v100"]],["Annotate",["b4","v100"],["meta_schedule.unroll_explicit"],[]],["EnterPostproc",[],[],[]],["Unannotate",["b74"],["meta_schedule.cooperative_fetch"],[]],["GetLoops",["b74"],[],["l101","l102","l103","l104","l105","l106","l107"]],["Split",["l107","None",128],[1],["l108","l109"]],["Bind",["l109"],["threadIdx.x"],[]],["Unannotate",["b87"],["meta_schedule.cooperative_fetch"],[]],["GetLoops",["b87"],[],["l110","l111","l112","l113","l114","l115","l116"]],["Split",["l116","None",128,3],[1],["l117","l118","l119"]],["Vectorize",["l119"],[],[]],["Bind",["l118"],["threadIdx.x"],[]],["GetBlock",[],["root","main"],["b120"]],["Unannotate",["b120"],["meta_schedule.unroll_explicit"],[]],["GetChildBlocks",["b120"],[],["b121","b122","b123","b124"]],["GetLoops",["b121"],[],["l125","l126","l127","l128","l129","l130","l131","l132"]],["GetLoops",["b122"],[],["l133","l134","l135","l136","l137","l138","l139","l140","l141"]],["GetLoops",["b123"],[],["l142","l143","l144","l145","l146","l147","l148","l149","l150","l151","l152","l153","l154","l155","l156","l157","l158","l159","l160","l161"]],["Annotate",["l142",64],["pragma_auto_unroll_max_step"],[]],["Annotate",["l142",1],["pragma_unroll_explicit"],[]],["GetLoops",["b124"],[],["l162","l163","l164","l165","l166","l167","l168"]],["GetBlock",[],["conv2d_nchw","main"],["b169"]],["GetLoops",["b169"],[],["l170","l171","l172","l173","l174","l175","l176","l177","l178","l179","l180","l181","l182","l183","l184","l185","l186","l187","l188","l189"]],["DecomposeReduction",["b169","l173"],[],["b190"]]],[[7,[1,1,1,2,1]],[9,[5,2,8,4,1]],[11,[4,1,8,2,2]],[13,[16,1,2,1,4]],[15,[160,1,2]],[17,[1,1,3]],[19,[1,1,3]],[36,2],[42,2],[47,2]]],[0.010498858400000001673],{"host":{"keys":["arm_cpu","cpu"],"kind":"llvm","mcpu":"apple-latest","mtriple":"arm64-apple-macos","tag":""},"keys":["metal","gpu"],"kind":"metal","max_function_args":31,"max_num_threads":256,"max_shared_memory_per_block":32768,"max_threads_per_block":256,"tag":"","thread_warp_size":32},[["TENSOR","float32",[2,320,128,128]],["TENSOR","float32",[320,320,3,3]],["TENSOR","float32",[1,320,1,1]],["TENSOR","float32",[2,320,1,1]],["TENSOR","float32",[2,320,128,128]]]]]
[5,[[[["GetBlock",[],["pad_temp","main"],["b0"]],["GetBlock",[],["conv2d_nchw","main"],["b1"]],["GetBlock",[],["T_add","main"],["b2"]],["GetBlock",[],["T_add_1","main"],["b3"]],["GetBlock",[],["root","main"],["b4"]],["Annotate",["b1","\"SSSRRSRS\""],["meta_schedule.tiling_structure"],[]],["GetLoops",["b1"],[],["l5","l6","l7","l8","l9","l10","l11"]],["SamplePerfectTile",["l5"],[5,64],["v12","v13","v14","v15","v16"]],["Split",["l5","v12","v13","v14","v15","v16"],[1],["l17","l18","l19","l20","l21"]],["SamplePerfectTile",["l6"],[5,64],["v22","v23","v24","v25","v26"]],["Split",["l6","v22","v23","v24","v25","v26"],[1],["l27","l28","l29","l30","l31"]],["SamplePerfectTile",["l7"],[5,64],["v32","v33","v34","v35","v36"]],["Split",["l7","v32","v33","v34","v35","v36"],[1],["l37","l38","l39","l40","l41"]],["SamplePerfectTile",["l8"],[5,64],["v42","v43","v44","v45","v46"]],["Split",["l8","v42","v43","v44","v45","v46"],[1],["l47","l48","l49","l50","l51"]],["SamplePerfectTile",["l9"],[3,64],["v52","v53","v54"]],["Split",["l9","v52","v53","v54"],[1],["l55","l56","l57"]],["SamplePerfectTile",["l10"],[3,64],["v58","v59","v60"]],["Split",["l10","v58","v59","v60"],[1],["l61","l62","l63"]],["SamplePerfectTile",["l11"],[3,64],["v64","v65","v66"]],["Split",["l11","v64","v65","v66"],[1],["l67","l68","l69"]],["Reorder",["l17","l27","l37","l47","l18","l28","l38","l48","l19","l29","l39","l49","l55","l61","l67","l56","l62","l68","l20","l30","l40","l50","l57","l63","l69","l21","l31","l41","l51"],[],[]],["Fuse",["l17","l27","l37","l47"],[1],["l70"]],["Bind",["l70"],["blockIdx.x"],[]],["Fuse",["l18","l28","l38","l48"],[1],["l71"]],["Bind",["l71"],["vthread.x"],[]],["Fuse",["l19","l29","l39","l49"],[1],["l72"]],["Bind",["l72"],["threadIdx.x"],[]],["Annotate",["b1",32],["meta_schedule.thread_extent_low_inclusive"],[]],["Annotate",["b1",256],["meta_schedule.thread_extent_high_inclusive"],[]],["CacheWrite",["b1",[]],[0,"local"],["b73"]],["ReverseComputeAt",["b73","l72"],[1,-1],[]],["CacheRead",["b1",["b1"]],[0,"shared"],["b74"]],["ComputeAt",["b74","l67"],[1,-1],[]],["GetLoops",["b74"],[],["l75","l76","l77","l78","l79","l80","l81","l82","l83","l84"]],["Fuse",["l81","l82","l83","l84"],[1],["l85"]],["SampleCategorical",[],[[1,2,3,4],[0.25,0.25,0.25,0.25]],["v86"]],["Annotate",["b74","v86"],["meta_schedule.cooperative_fetch"],[]],["CacheRead",["b1",["b1"]],[1,"shared"],["b87"]],["ComputeAt",["b87","l67"],[1,-1],[]],["GetLoops",["b87"],[],["l88","l89","l90","l91","l92","l93","l94","l95","l96","l97"]],["Fuse",["l94","l95","l96","l97"],[1],["l98"]],["SampleCategorical",[],[[1,2,3,4],[0.25,0.25,0.25,0.25]],["v99"]],["Annotate",["b87","v99"],["meta_schedule.cooperative_fetch"],[]],["ReverseComputeInline",["b3"],[],[]],["ReverseComputeInline",["b2"],[],[]],["ComputeInline",["b0"],[],[]],["SampleCategorical",[],[[0,16,64,512,1024],[0.2000000000000000111,0.2000000000000000111,0.2000000000000000111,0.2000000000000000111,0.2000000000000000111]],["v100"]],["Annotate",["b4","v100"],["meta_schedule.unroll_explicit"],[]],["EnterPostproc",[],[],[]],["Unannotate",["b74"],["meta_schedule.cooperative_fetch"],[]],["GetLoops",["b74"],[],["l101","l102","l103","l104","l105","l106","l107"]],["Split",["l107","None",64,2],[1],["l108","l109","l110"]],["Vectorize",["l110"],[],[]],["Bind",["l109"],["threadIdx.x"],[]],["Unannotate",["b87"],["meta_schedule.cooperative_fetch"],[]],["GetLoops",["b87"],[],["l111","l112","l113","l114","l115","l116","l117"]],["Split",["l117","None",64,3],[1],["l118","l119","l120"]],["Vectorize",["l120"],[],[]],["Bind",["l119"],["threadIdx.x"],[]],["GetBlock",[],["root","main"],["b121"]],["Unannotate",["b121"],["meta_schedule.unroll_explicit"],[]],["GetChildBlocks",["b121"],[],["b122","b123","b124","b125"]],["GetLoops",["b122"],[],["l126","l127","l128","l129","l130","l131","l132","l133","l134"]],["GetLoops",["b123"],[],["l135","l136","l137","l138","l139","l140","l141","l142","l143"]],["GetLoops",["b124"],[],["l144","l145","l146","l147","l148","l149","l150","l151","l152","l153","l154","l155","l156","l157","l158","l159","l160","l161","l162","l163"]],["GetLoops",["b125"],[],["l164","l165","l166","l167","l168","l169","l170"]],["GetBlock",[],["conv2d_nchw","main"],["b171"]],["GetLoops",["b171"],[],["l172","l173","l174","l175","l176","l177","l178","l179","l180","l181","l182","l183","l184","l185","l186","l187","l188","l189","l190","l191"]],["DecomposeReduction",["b171","l175"],[],["b192"]]],[[7,[2,1,1,1,1]],[9,[10,1,16,4,1]],[11,[64,1,1,1,1]],[13,[2,4,4,2,1]],[15,[640,1,1]],[17,[1,3,1]],[19,[1,1,3]],[36,1],[42,2],[47,0]]],[0.007598892857142857879],{"host":{"keys":["arm_cpu","cpu"],"kind":"llvm","mcpu":"apple-latest","mtriple":"arm64-apple-macos","tag":""},"keys":["metal","gpu"],"kind":"metal","max_function_args":31,"max_num_threads":256,"max_shared_memory_per_block":32768,"max_threads_per_block":256,"tag":"","thread_warp_size":32},[["TENSOR","float32",[2,640,64,64]],["TENSOR","float32",[640,640,3,3]],["TENSOR","float32",[1,640,1,1]],["TENSOR","float32",[2,640,1,1]],["TENSOR","float32",[2,640,64,64]]]]]
[6,[[[["GetBlock",[],["pad_temp","main"],["b0"]],["GetBlock",[],["conv2d_nchw","main"],["b1"]],["GetBlock",[],["T_add","main"],["b2"]],["GetBlock",[],["T_add_1","main"],["b3"]],["GetBlock",[],["T_divide","main"],["b4"]],["GetBlock",[],["root","main"],["b5"]],["Annotate",["b1","\"SSSRRSRS\""],["meta_schedule.tiling_structure"],[]],["GetLoops",["b1"],[],["l6","l7","l8","l9","l10","l11","l12"]],["SamplePerfectTile",["l6"],[5,64],["v13","v14","v15","v16","v17"]],["Split",["l6","v13","v14","v15","v16","v17"],[1],["l18","l19","l20","l21","l22"]],["SamplePerfectTile",["l7"],[5,64],["v23","v24","v25","v26","v27"]],["Split",["l7","v23","v24","v25","v26","v27"],[1],["l28","l29","l30","l31","l32"]],["SamplePerfectTile",["l8"],[5,64],["v33","v34","v35","v36","v37"]],["Split",["l8","v33","v34","v35","v36","v37"],[1],["l38","l39","l40","l41","l42"]],["SamplePerfectTile",["l9"],[5,64],["v43","v44","v45","v46","v47"]],["Split",["l9","v43","v44","v45","v46","v47"],[1],["l48","l49","l50","l51","l52"]],["SamplePerfectTile",["l10"],[3,64],["v53","v54","v55"]],["Split",["l10","v53","v54","v55"],[1],["l56","l57","l58"]],["SamplePerfectTile",["l11"],[3,64],["v59","v60","v61"]],["Split",["l11","v59","v60","v61"],[1],["l62","l63","l64"]],["SamplePerfectTile",["l12"],[3,64],["v65","v66","v67"]],["Split",["l12","v65","v66","v67"],[1],["l68","l69","l70"]],["Reorder",["l18","l28","l38","l48","l19","l29","l39","l49","l20","l30","l40","l50","l56","l62","l68","l57","l63","l69","l21","l31","l41","l51","l58","l64","l70","l22","l32","l42","l52"],[],[]],["Fuse",["l18","l28","l38","l48"],[1],["l71"]],["Bind",["l71"],["blockIdx.x"],[]],["Fuse",["l19","l29","l39","l49"],[1],["l72"]],["Bind",["l72"],["vthread.x"],[]],["Fuse",["l20","l30","l40","l50"],[1],["l73"]],["Bind",["l73"],["threadIdx.x"],[]],["Annotate",["b1",32],["meta_schedule.thread_extent_low_inclusive"],[]],["Annotate",["b1",256],["meta_schedule.thread_extent_high_inclusive"],[]],["CacheWrite",["b1",[]],[0,"local"],["b74"]],["ReverseComputeAt",["b74","l73"],[1,-1],[]],["CacheRead",["b1",["b1"]],[0,"shared"],["b75"]],["ComputeAt",["b75","l68"],[1,-1],[]],["GetLoops",["b75"],[],["l76","l77","l78","l79","l80","l81","l82","l83","l84","l85"]],["Fuse",["l82","l83","l84","l85"],[1],["l86"]],["SampleCategorical",[],[[1,2,3,4],[0.25,0.25,0.25,0.25]],["v87"]],["Annotate",["b75","v87"],["meta_schedule.cooperative_fetch"],[]],["CacheRead",["b1",["b1"]],[1,"shared"],["b88"]],["ComputeAt",["b88","l68"],[1,-1],[]],["GetLoops",["b88"],[],["l89","l90","l91","l92","l93","l94","l95","l96","l97","l98"]],["Fuse",["l95","l96","l97","l98"],[1],["l99"]],["SampleCategorical",[],[[1,2,3,4],[0.25,0.25,0.25,0.25]],["v100"]],["Annotate",["b88","v100"],["meta_schedule.cooperative_fetch"],[]],["ReverseComputeInline",["b4"],[],[]],["ReverseComputeInline",["b3"],[],[]],["ReverseComputeInline",["b2"],[],[]],["ComputeInline",["b0"],[],[]],["SampleCategorical",[],[[0,16,64,512,1024],[0.2000000000000000111,0.2000000000000000111,0.2000000000000000111,0.2000000000000000111,0.2000000000000000111]],["v101"]],["Annotate",["b5","v101"],["meta_schedule.unroll_explicit"],[]],["EnterPostproc",[],[],[]],["Unannotate",["b75"],["meta_schedule.cooperative_fetch"],[]],["GetLoops",["b75"],[],["l102","l103","l104","l105","l106","l107","l108"]],["Split",["l108","None",160,3],[1],["l109","l110","l111"]],["Vectorize",["l111"],[],[]],["Bind",["l110"],["threadIdx.x"],[]],["Unannotate",["b88"],["meta_schedule.cooperative_fetch"],[]],["GetLoops",["b88"],[],["l112","l113","l114","l115","l116","l117","l118"]],["Split",["l118","None",160,3],[1],["l119","l120","l121"]],["Vectorize",["l121"],[],[]],["Bind",["l120"],["threadIdx.x"],[]],["GetBlock",[],["root","main"],["b122"]],["Unannotate",["b122"],["meta_schedule.unroll_explicit"],[]],["GetChildBlocks",["b122"],[],["b123","b124","b125","b126"]],["GetLoops",["b123"],[],["l127","l128","l129","l130","l131","l132","l133","l134","l135"]],["GetLoops",["b124"],[],["l136","l137","l138","l139","l140","l141","l142","l143","l144"]],["GetLoops",["b125"],[],["l145","l146","l147","l148","l149","l150","l151","l152","l153","l154","l155","l156","l157","l158","l159","l160","l161","l162","l163","l164"]],["GetLoops",["b126"],[],["l165","l166","l167","l168","l169","l170","l171"]],["GetBlock",[],["conv2d_nchw","main"],["b172"]],["GetLoops",["b172"],[],["l173","l174","l175","l176","l177","l178","l179","l180","l181","l182","l183","l184","l185","l186","l187","l188","l189","l190","l191","l192"]],["DecomposeReduction",["b172","l176"],[],["b193"]]],[[8,[1,2,1,1,1]],[10,[8,2,20,1,1]],[12,[16,1,4,2,1]],[14,[32,1,2,2,1]],[16,[80,4,1]],[18,[1,1,3]],[20,[1,3,1]],[37,2],[43,2],[49,0]]],[0.0080377756153846152687],{"host":{"keys":["arm_cpu","cpu"],"kind":"llvm","mcpu":"apple-latest","mtriple":"arm64-apple-macos","tag":""},"keys":["metal","gpu"],"kind":"metal","max_function_args":31,"max_num_threads":256,"max_shared_memory_per_block":32768,"max_threads_per_block":256,"tag":"","thread_warp_size":32},[["TENSOR","float32",[2,320,128,128]],["TENSOR","float32",[320,320,3,3]],["TENSOR","float32",[1,320,1,1]],["TENSOR","float32",[2,320,128,128]],["TENSOR","float32",[2,320,128,128]]]]]
[7,[[[["GetBlock",[],["matmul","main"],["b0"]],["GetBlock",[],["T_multiply","main"],["b1"]],["GetBlock",[],["root","main"],["b2"]],["Annotate",["b0","\"SSSRRSRS\""],["meta_schedule.tiling_structure"],[]],["GetLoops",["b0"],[],["l3","l4","l5","l6","l7"]],["SamplePerfectTile",["l3"],[5,64],["v8","v9","v10","v11","v12"]],["Split",["l3","v8","v9","v10","v11","v12"],[1],["l13","l14","l15","l16","l17"]],["SamplePerfectTile",["l4"],[5,64],["v18","v19","v20","v21","v22"]],["Split",["l4","v18","v19","v20","v21","v22"],[1],["l23","l24","l25","l26","l27"]],["SamplePerfectTile",["l5"],[5,64],["v28","v29","v30","v31","v32"]],["Split",["l5","v28","v29","v30","v31","v32"],[1],["l33","l34","l35","l36","l37"]],["SamplePerfectTile",["l6"],[5,64],["v38","v39","v40","v41","v42"]],["Split",["l6","v38","v39","v40","v41","v42"],[1],["l43","l44","l45","l46","l47"]],["SamplePerfectTile",["l7"],[3,64],["v48","v49","v50"]],["Split",["l7","v48","v49","v50"],[1],["l51","l52","l53"]],["Reorder",["l13","l23","l33","l43","l14","l24","l34","l44","l15","l25","l35","l45","l51","l52","l16","l26","l36","l46","l53","l17","l27","l37","l47"],[],[]],["Fuse",["l13","l23","l33","l43"],[1],["l54"]],["Bind",["l54"],["blockIdx.x"],[]],["Fuse",["l14","l24","l34","l44"],[1],["l55"]],["Bind",["l55"],["vthread.x"],[]],["Fuse",["l15","l25","l35","l45"],[1],["l56"]],["Bind",["l56"],["threadIdx.x"],[]],["Annotate",["b0",32],["meta_schedule.thread_extent_low_inclusive"],[]],["Annotate",["b0",256],["meta_schedule.thread_extent_high_inclusive"],[]],["CacheWrite",["b0",[]],[0,"local"],["b57"]],["ReverseComputeAt",["b57","l56"],[1,-1],[]],["CacheRead",["b0",["b0"]],[0,"shared"],["b58"]],["ComputeAt",["b58","l51"],[1,-1],[]],["GetLoops",["b58"],[],["l59","l60","l61","l62","l63","l64","l65","l66"]],["Fuse",["l63","l64","l65","l66"],[1],["l67"]],["SampleCategorical",[],[[1,2,3,4],[0.25,0.25,0.25,0.25]],["v68"]],["Annotate",["b58","v68"],["meta_schedule.cooperative_fetch"],[]],["CacheRead",["b0",["b0"]],[1,"shared"],["b69"]],["ComputeAt",["b69","l51"],[1,-1],[]],["GetLoops",["b69"],[],["l70","l71","l72","l73","l74","l75","l76","l77"]],["Fuse",["l74","l75","l76","l77"],[1],["l78"]],["SampleCategorical",[],[[1,2,3,4],[0.25,0.25,0.25,0.25]],["v79"]],["Annotate",["b69","v79"],["meta_schedule.cooperative_fetch"],[]],["ReverseComputeInline",["b1"],[],[]],["SampleCategorical",[],[[0,16,64,512,1024],[0.2000000000000000111,0.2000000000000000111,0.2000000000000000111,0.2000000000000000111,0.2000000000000000111]],["v80"]],["Annotate",["b2","v80"],["meta_schedule.unroll_explicit"],[]],["EnterPostproc",[],[],[]],["Unannotate",["b58"],["meta_schedule.cooperative_fetch"],[]],["GetLoops",["b58"],[],["l81","l82","l83","l84","l85"]],["Split",["l85","None",64,2],[1],["l86","l87","l88"]],["Vectorize",["l88"],[],[]],["Bind",["l87"],["threadIdx.x"],[]],["Unannotate",["b69"],["meta_schedule.cooperative_fetch"],[]],["GetLoops",["b69"],[],["l89","l90","l91","l92","l93"]],["Split",["l93","None",64,2],[1],["l94","l95","l96"]],["Vectorize",["l96"],[],[]],["Bind",["l95"],["threadIdx.x"],[]],["GetBlock",[],["root","main"],["b97"]],["Unannotate",["b97"],["meta_schedule.unroll_explicit"],[]],["GetChildBlocks",["b97"],[],["b98","b99","b100","b101"]],["GetLoops",["b98"],[],["l102","l103","l104","l105","l106","l107","l108"]],["GetLoops",["b99"],[],["l109","l110","l111","l112","l113","l114","l115"]],["GetLoops",["b100"],[],["l116","l117","l118","l119","l120","l121","l122","l123","l124","l125","l126","l127","l128","l129"]],["Annotate",["l116",1024],["pragma_auto_unroll_max_step"],[]],["Annotate",["l116",1],["pragma_unroll_explicit"],[]],["GetLoops",["b101"],[],["l130","l131","l132","l133","l134","l135","l136"]],["GetBlock",[],["matmul","main"],["b137"]],["GetLoops",["b137"],[],["l138","l139","l140","l141","l142","l143","l144","l145","l146","l147","l148","l149","l150","l151"]],["DecomposeReduction",["b137","l141"],[],["b152"]]],[[5,[2,1,1,1,1]],[7,[10,1,1,1,1]],[9,[128,4,2,1,4]],[11,[32,4,32,1,1]],[13,[16,1,4]],[30,1],[36,1],[39,4]]],[0.0045388712121212119663],{"host":{"keys":["arm_cpu","cpu"],"kind":"llvm","mcpu":"apple-latest","mtriple":"arm64-apple-macos","tag":""},"keys":["metal","gpu"],"kind":"metal","max_function_args":31,"max_num_threads":256,"max_shared_memory_per_block":32768,"max_threads_per_block":256,"tag":"","thread_warp_size":32},[["TENSOR","float32",[2,10,4096,64]],["TENSOR","float32",[2,10,64,4096]],["TENSOR","float32",[]],["TENSOR","float32",[2,10,4096,4096]]]]]
[8,[[[["GetBlock",[],["pad_temp","main"],["b0"]],["GetBlock",[],["conv2d_nchw","main"],["b1"]],["GetBlock",[],["T_add","main"],["b2"]],["GetBlock",[],["T_add_1","main"],["b3"]],["GetBlock",[],["root","main"],["b4"]],["Annotate",["b1","\"SSSRRSRS\""],["meta_schedule.tiling_structure"],[]],["GetLoops",["b1"],[],["l5","l6","l7","l8","l9","l10","l11"]],["SamplePerfectTile",["l5"],[5,64],["v12","v13","v14","v15","v16"]],["Split",["l5","v12","v13","v14","v15","v16"],[1],["l17","l18","l19","l20","l21"]],["SamplePerfectTile",["l6"],[5,64],["v22","v23","v24","v25","v26"]],["Split",["l6","v22","v23","v24","v25","v26"],[1],["l27","l28","l29","l30","l31"]],["SamplePerfectTile",["l7"],[5,64],["v32","v33","v34","v35","v36"]],["Split",["l7","v32","v33","v34","v35","v36"],[1],["l37","l38","l39","l40","l41"]],["SamplePerfectTile",["l8"],[5,64],["v42","v43","v44","v45","v46"]],["Split",["l8","v42","v43","v44","v45","v46"],[1],["l47","l48","l49","l50","l51"]],["SamplePerfectTile",["l9"],[3,64],["v52","v53","v54"]],["Split",["l9","v52","v53","v54"],[1],["l55","l56","l57"]],["SamplePerfectTile",["l10"],[3,64],["v58","v59","v60"]],["Split",["l10","v58","v59","v60"],[1],["l61","l62","l63"]],["SamplePerfectTile",["l11"],[3,64],["v64","v65","v66"]],["Split",["l11","v64","v65","v66"],[1],["l67","l68","l69"]],["Reorder",["l17","l27","l37","l47","l18","l28","l38","l48","l19","l29","l39","l49","l55","l61","l67","l56","l62","l68","l20","l30","l40","l50","l57","l63","l69","l21","l31","l41","l51"],[],[]],["Fuse",["l17","l27","l37","l47"],[1],["l70"]],["Bind",["l70"],["blockIdx.x"],[]],["Fuse",["l18","l28","l38","l48"],[1],["l71"]],["Bind",["l71"],["vthread.x"],[]],["Fuse",["l19","l29","l39","l49"],[1],["l72"]],["Bind",["l72"],["threadIdx.x"],[]],["Annotate",["b1",32],["meta_schedule.thread_extent_low_inclusive"],[]],["Annotate",["b1",256],["meta_schedule.thread_extent_high_inclusive"],[]],["CacheWrite",["b1",[]],[0,"local"],["b73"]],["ReverseComputeAt",["b73","l72"],[1,-1],[]],["CacheRead",["b1",["b1"]],[0,"shared"],["b74"]],["ComputeAt",["b74","l67"],[1,-1],[]],["GetLoops",["b74"],[],["l75","l76","l77","l78","l79","l80","l81","l82","l83","l84"]],["Fuse",["l81","l82","l83","l84"],[1],["l85"]],["SampleCategorical",[],[[1,2,3,4],[0.25,0.25,0.25,0.25]],["v86"]],["Annotate",["b74","v86"],["meta_schedule.cooperative_fetch"],[]],["CacheRead",["b1",["b1"]],[1,"shared"],["b87"]],["ComputeAt",["b87","l67"],[1,-1],[]],["GetLoops",["b87"],[],["l88","l89","l90","l91","l92","l93","l94","l95","l96","l97"]],["Fuse",["l94","l95","l96","l97"],[1],["l98"]],["SampleCategorical",[],[[1,2,3,4],[0.25,0.25,0.25,0.25]],["v99"]],["Annotate",["b87","v99"],["meta_schedule.cooperative_fetch"],[]],["ReverseComputeInline",["b3"],[],[]],["ReverseComputeInline",["b2"],[],[]],["ComputeInline",["b0"],[],[]],["SampleCategorical",[],[[0,16,64,512,1024],[0.2000000000000000111,0.2000000000000000111,0.2000000000000000111,0.2000000000000000111,0.2000000000000000111]],["v100"]],["Annotate",["b4","v100"],["meta_schedule.unroll_explicit"],[]],["EnterPostproc",[],[],[]],["Unannotate",["b74"],["meta_schedule.cooperative_fetch"],[]],["GetLoops",["b74"],[],["l101","l102","l103","l104","l105","l106","l107"]],["Split",["l107","None",64],[1],["l108","l109"]],["Bind",["l109"],["threadIdx.x"],[]],["Unannotate",["b87"],["meta_schedule.cooperative_fetch"],[]],["GetLoops",["b87"],[],["l110","l111","l112","l113","l114","l115","l116"]],["Split",["l116","None",64,3],[1],["l117","l118","l119"]],["Vectorize",["l119"],[],[]],["Bind",["l118"],["threadIdx.x"],[]],["GetBlock",[],["root","main"],["b120"]],["Unannotate",["b120"],["meta_schedule.unroll_explicit"],[]],["GetChildBlocks",["b120"],[],["b121","b122","b123","b124"]],["GetLoops",["b121"],[],["l125","l126","l127","l128","l129","l130","l131","l132"]],["GetLoops",["b122"],[],["l133","l134","l135","l136","l137","l138","l139","l140","l141"]],["GetLoops",["b123"],[],["l142","l143","l144","l145","l146","l147","l148","l149","l150","l151","l152","l153","l154","l155","l156","l157","l158","l159","l160","l161"]],["GetLoops",["b124"],[],["l162","l163","l164","l165","l166","l167","l168"]],["GetBlock",[],["conv2d_nchw","main"],["b169"]],["GetLoops",["b169"],[],["l170","l171","l172","l173","l174","l175","l176","l177","l178","l179","l180","l181","l182","l183","l184","l185","l186","l187","l188","l189"]],["DecomposeReduction",["b169","l173"],[],["b190"]]],[[7,[1,1,2,1,1]],[9,[5,4,16,2,1]],[11,[16,1,1,2,2]],[13,[32,1,2,1,1]],[15,[320,1,1]],[17,[1,1,3]],[19,[1,3,1]],[36,0],[42,2],[47,0]]],[0.0043649239130434782166],{"host":{"keys":["arm_cpu","cpu"],"kind":"llvm","mcpu":"apple-latest","mtriple":"arm64-apple-macos","tag":""},"keys":["metal","gpu"],"kind":"metal","max_function_args":31,"max_num_threads":256,"max_shared_memory_per_block":32768,"max_threads_per_block":256,"tag":"","thread_warp_size":32},[["TENSOR","float32",[2,320,64,64]],["TENSOR","float32",[640,320,3,3]],["TENSOR","float32",[1,640,1,1]],["TENSOR","float32",[2,640,1,1]],["TENSOR","float32",[2,640,64,64]]]]]
[9,[[[["GetBlock",[],["pad_temp","main"],["b0"]],["GetBlock",[],["conv2d_nchw","main"],["b1"]],["GetBlock",[],["T_add","main"],["b2"]],["GetBlock",[],["root","main"],["b3"]],["Annotate",["b1","\"SSSRRSRS\""],["meta_schedule.tiling_structure"],[]],["GetLoops",["b1"],[],["l4","l5","l6","l7","l8","l9","l10"]],["SamplePerfectTile",["l4"],[5,64],["v11","v12","v13","v14","v15"]],["Split",["l4","v11","v12","v13","v14","v15"],[1],["l16","l17","l18","l19","l20"]],["SamplePerfectTile",["l5"],[5,64],["v21","v22","v23","v24","v25"]],["Split",["l5","v21","v22","v23","v24","v25"],[1],["l26","l27","l28","l29","l30"]],["SamplePerfectTile",["l6"],[5,64],["v31","v32","v33","v34","v35"]],["Split",["l6","v31","v32","v33","v34","v35"],[1],["l36","l37","l38","l39","l40"]],["SamplePerfectTile",["l7"],[5,64],["v41","v42","v43","v44","v45"]],["Split",["l7","v41","v42","v43","v44","v45"],[1],["l46","l47","l48","l49","l50"]],["SamplePerfectTile",["l8"],[3,64],["v51","v52","v53"]],["Split",["l8","v51","v52","v53"],[1],["l54","l55","l56"]],["SamplePerfectTile",["l9"],[3,64],["v57","v58","v59"]],["Split",["l9","v57","v58","v59"],[1],["l60","l61","l62"]],["SamplePerfectTile",["l10"],[3,64],["v63","v64","v65"]],["Split",["l10","v63","v64","v65"],[1],["l66","l67","l68"]],["Reorder",["l16","l26","l36","l46","l17","l27","l37","l47","l18","l28","l38","l48","l54","l60","l66","l55","l61","l67","l19","l29","l39","l49","l56","l62","l68","l20","l30","l40","l50"],[],[]],["Fuse",["l16","l26","l36","l46"],[1],["l69"]],["Bind",["l69"],["blockIdx.x"],[]],["Fuse",["l17","l27","l37","l47"],[1],["l70"]],["Bind",["l70"],["vthread.x"],[]],["Fuse",["l18","l28","l38","l48"],[1],["l71"]],["Bind",["l71"],["threadIdx.x"],[]],["Annotate",["b1",32],["meta_schedule.thread_extent_low_inclusive"],[]],["Annotate",["b1",256],["meta_schedule.thread_extent_high_inclusive"],[]],["CacheWrite",["b1",[]],[0,"local"],["b72"]],["ReverseComputeAt",["b72","l71"],[1,-1],[]],["CacheRead",["b1",["b1"]],[0,"shared"],["b73"]],["ComputeAt",["b73","l66"],[1,-1],[]],["GetLoops",["b73"],[],["l74","l75","l76","l77","l78","l79","l80","l81","l82","l83"]],["Fuse",["l80","l81","l82","l83"],[1],["l84"]],["SampleCategorical",[],[[1,2,3,4],[0.25,0.25,0.25,0.25]],["v85"]],["Annotate",["b73","v85"],["meta_schedule.cooperative_fetch"],[]],["CacheRead",["b1",["b1"]],[1,"shared"],["b86"]],["ComputeAt",["b86","l66"],[1,-1],[]],["GetLoops",["b86"],[],["l87","l88","l89","l90","l91","l92","l93","l94","l95","l96"]],["Fuse",["l93","l94","l95","l96"],[1],["l97"]],["SampleCategorical",[],[[1,2,3,4],[0.25,0.25,0.25,0.25]],["v98"]],["Annotate",["b86","v98"],["meta_schedule.cooperative_fetch"],[]],["ReverseComputeInline",["b2"],[],[]],["ComputeInline",["b0"],[],[]],["SampleCategorical",[],[[0,16,64,512,1024],[0.2000000000000000111,0.2000000000000000111,0.2000000000000000111,0.2000000000000000111,0.2000000000000000111]],["v99"]],["Annotate",["b3","v99"],["meta_schedule.unroll_explicit"],[]],["EnterPostproc",[],[],[]],["Unannotate",["b73"],["meta_schedule.cooperative_fetch"],[]],["GetLoops",["b73"],[],["l100","l101","l102","l103","l104","l105","l106"]],["Split",["l106","None",128,4],[1],["l107","l108","l109"]],["Vectorize",["l109"],[],[]],["Bind",["l108"],["threadIdx.x"],[]],["Unannotate",["b86"],["meta_schedule.cooperative_fetch"],[]],["GetLoops",["b86"],[],["l110","l111","l112","l113","l114","l115","l116"]],["Split",["l116","None",128],[1],["l117","l118"]],["Bind",["l118"],["threadIdx.x"],[]],["GetBlock",[],["root","main"],["b119"]],["Unannotate",["b119"],["meta_schedule.unroll_explicit"],[]],["GetChildBlocks",["b119"],[],["b120","b121","b122","b123"]],["GetLoops",["b120"],[],["l124","l125","l126","l127","l128","l129","l130","l131","l132"]],["GetLoops",["b121"],[],["l133","l134","l135","l136","l137","l138","l139","l140"]],["GetLoops",["b122"],[],["l141","l142","l143","l144","l145","l146","l147","l148","l149","l150","l151","l152","l153","l154","l155","l156","l157","l158","l159","l160"]],["Annotate",["l141",16],["pragma_auto_unroll_max_step"],[]],["Annotate",["l141",1],["pragma_unroll_explicit"],[]],["GetLoops",["b123"],[],["l161","l162","l163","l164","l165","l166","l167"]],["GetBlock",[],["conv2d_nchw","main"],["b168"]],["GetLoops",["b168"],[],["l169","l170","l171","l172","l173","l174","l175","l176","l177","l178","l179","l180","l181","l182","l183","l184","l185","l186","l187","l188"]],["DecomposeReduction",["b168","l172"],[],["b189"]]],[[6,[2,1,1,1,1]],[8,[10,2,4,8,1]],[10,[32,1,2,1,1]],[12,[2,1,16,2,1]],[14,[80,4,6]],[16,[1,1,1]],[18,[1,1,1]],[35,3],[41,0],[45,1]]],[0.0030446508399999999868],{"host":{"keys":["arm_cpu","cpu"],"kind":"llvm","mcpu":"apple-latest","mtriple":"arm64-apple-macos","tag":""},"keys":["metal","gpu"],"kind":"metal","max_function_args":31,"max_num_threads":256,"max_shared_memory_per_block":32768,"max_threads_per_block":256,"tag":"","thread_warp_size":32},[["TENSOR","float32",[2,1920,64,64]],["TENSOR","float32",[640,1920,1,1]],["TENSOR","float32",[1,640,1,1]],["TENSOR","float32",[2,640,64,64]]]]]
[10,[[[["GetBlock",[],["T_reshape","main"],["b0"]],["GetBlock",[],["A_red_temp","main"],["b1"]],["GetBlock",[],["T_reshape_1","main"],["b2"]],["GetBlock",[],["T_reshape_2","main"],["b3"]],["GetBlock",[],["T_group_norm","main"],["b4"]],["GetBlock",[],["T_reshape_3","main"],["b5"]],["GetBlock",[],["compute","main"],["b6"]],["GetBlock",[],["T_multiply","main"],["b7"]],["GetBlock",[],["root","main"],["b8"]],["ComputeInline",["b6"],[],[]],["ComputeInline",["b5"],[],[]],["ComputeInline",["b4"],[],[]],["ComputeInline",["b3"],[],[]],["ComputeInline",["b2"],[],[]],["ComputeInline",["b0"],[],[]],["SampleCategorical",[],[[4,8,16,32,64,128,256,512],[0.125,0.125,0.125,0.125,0.125,0.125,0.125,0.125]],["v9"]],["GetLoops",["b1"],[],["l10","l11","l12","l13","l14"]],["Fuse",["l12","l13","l14"],[1],["l15"]],["Split",["l15","None","v9"],[1],["l16","l17"]],["Bind",["l17"],["threadIdx.x"],[]],["SampleCategorical",[],[[0,16,64,512,1024],[0.2000000000000000111,0.2000000000000000111,0.2000000000000000111,0.2000000000000000111,0.2000000000000000111]],["v18"]],["Annotate",["b8","v18"],["meta_schedule.unroll_explicit"],[]],["GetLoops",["b7"],[],["l19","l20","l21","l22"]],["Fuse",["l19","l20","l21","l22"],[1],["l23"]],["Split",["l23","None",256,256],[1],["l24","l25","l26"]],["Reorder",["l25","l26","l24"],[],[]],["Bind",["l25"],["blockIdx.x"],[]],["Bind",["l26"],["threadIdx.x"],[]],["GetLoops",["b1"],[],["l27","l28","l29","l30"]],["Fuse",["l27","l28"],[1],["l31"]],["Bind",["l31"],["blockIdx.x"],[]],["EnterPostproc",[],[],[]],["GetBlock",[],["root","main"],["b32"]],["Unannotate",["b32"],["meta_schedule.unroll_explicit"],[]],["GetChildBlocks",["b32"],[],["b33","b34"]],["GetLoops",["b33"],[],["l35","l36","l37"]],["GetLoops",["b34"],[],["l38","l39","l40"]]],[[15,5],[20,0]]],[0.0027794925714285717219],{"host":{"keys":["arm_cpu","cpu"],"kind":"llvm","mcpu":"apple-latest","mtriple":"arm64-apple-macos","tag":""},"keys":["metal","gpu"],"kind":"metal","max_function_args":31,"max_num_threads":256,"max_shared_memory_per_block":32768,"max_threads_per_block":256,"tag":"","thread_warp_size":32},[["TENSOR","float32",[1,512,512,512]],["TENSOR","float32",[512]],["TENSOR","float32",[512]],["TENSOR","float32",[1,512,512,512]]]]]
[11,[[[["GetBlock",[],["matmul","main"],["b0"]],["GetBlock",[],["T_add","main"],["b1"]],["GetBlock",[],["T_add_1","main"],["b2"]],["GetBlock",[],["root","main"],["b3"]],["Annotate",["b0","\"SSSRRSRS\""],["meta_schedule.tiling_structure"],[]],["GetLoops",["b0"],[],["l4","l5","l6","l7"]],["SamplePerfectTile",["l4"],[5,64],["v8","v9","v10","v11","v12"]],["Split",["l4","v8","v9","v10","v11","v12"],[1],["l13","l14","l15","l16","l17"]],["SamplePerfectTile",["l5"],[5,64],["v18","v19","v20","v21","v22"]],["Split",["l5","v18","v19","v20","v21","v22"],[1],["l23","l24","l25","l26","l27"]],["SamplePerfectTile",["l6"],[5,64],["v28","v29","v30","v31","v32"]],["Split",["l6","v28","v29","v30","v31","v32"],[1],["l33","l34","l35","l36","l37"]],["SamplePerfectTile",["l7"],[3,64],["v38","v39","v40"]],["Split",["l7","v38","v39","v40"],[1],["l41","l42","l43"]],["Reorder",["l13","l23","l33","l14","l24","l34","l15","l25","l35","l41","l42","l16","l26","l36","l43","l17","l27","l37"],[],[]],["Fuse",["l13","l23","l33"],[1],["l44"]],["Bind",["l44"],["blockIdx.x"],[]],["Fuse",["l14","l24","l34"],[1],["l45"]],["Bind",["l45"],["vthread.x"],[]],["Fuse",["l15","l25","l35"],[1],["l46"]],["Bind",["l46"],["threadIdx.x"],[]],["Annotate",["b0",32],["meta_schedule.thread_extent_low_inclusive"],[]],["Annotate",["b0",256],["meta_schedule.thread_extent_high_inclusive"],[]],["CacheWrite",["b0",[]],[0,"local"],["b47"]],["ReverseComputeAt",["b47","l46"],[1,-1],[]],["CacheRead",["b0",["b0"]],[0,"shared"],["b48"]],["ComputeAt",["b48","l41"],[1,-1],[]],["GetLoops",["b48"],[],["l49","l50","l51","l52","l53","l54","l55"]],["Fuse",["l53","l54","l55"],[1],["l56"]],["SampleCategorical",[],[[1,2,3,4],[0.25,0.25,0.25,0.25]],["v57"]],["Annotate",["b48","v57"],["meta_schedule.cooperative_fetch"],[]],["CacheRead",["b0",["b0"]],[1,"shared"],["b58"]],["ComputeAt",["b58","l41"],[1,-1],[]],["GetLoops",["b58"],[],["l59","l60","l61","l62","l63","l64"]],["Fuse",["l63","l64"],[1],["l65"]],["SampleCategorical",[],[[1,2,3,4],[0.25,0.25,0.25,0.25]],["v66"]],["Annotate",["b58","v66"],["meta_schedule.cooperative_fetch"],[]],["ReverseComputeInline",["b2"],[],[]],["ReverseComputeInline",["b1"],[],[]],["SampleCategorical",[],[[0,16,64,512,1024],[0.2000000000000000111,0.2000000000000000111,0.2000000000000000111,0.2000000000000000111,0.2000000000000000111]],["v67"]],["Annotate",["b3","v67"],["meta_schedule.unroll_explicit"],[]],["EnterPostproc",[],[],[]],["Unannotate",["b48"],["meta_schedule.cooperative_fetch"],[]],["GetLoops",["b48"],[],["l68","l69","l70","l71","l72"]],["Split",["l72","None",128,4],[1],["l73","l74","l75"]],["Vectorize",["l75"],[],[]],["Bind",["l74"],["threadIdx.x"],[]],["Unannotate",["b58"],["meta_schedule.cooperative_fetch"],[]],["GetLoops",["b58"],[],["l76","l77","l78","l79","l80"]],["Split",["l80","None",128,2],[1],["l81","l82","l83"]],["Vectorize",["l83"],[],[]],["Bind",["l82"],["threadIdx.x"],[]],["GetBlock",[],["root","main"],["b84"]],["Unannotate",["b84"],["meta_schedule.unroll_explicit"],[]],["GetChildBlocks",["b84"],[],["b85","b86","b87","b88"]],["GetLoops",["b85"],[],["l89","l90","l91","l92","l93","l94","l95"]],["GetLoops",["b86"],[],["l96","l97","l98","l99","l100","l101","l102"]],["GetLoops",["b87"],[],["l103","l104","l105","l106","l107","l108","l109","l110","l111","l112","l113","l114"]],["GetLoops",["b88"],[],["l115","l116","l117","l118","l119","l120"]],["GetBlock",[],["matmul","main"],["b121"]],["GetLoops",["b121"],[],["l122","l123","l124","l125","l126","l127","l128","l129","l130","l131","l132","l133"]],["DecomposeReduction",["b121","l125"],[],["b134"]]],[[6,[1,2,1,1,1]],[8,[256,1,8,2,1]],[10,[10,1,16,4,1]],[12,[128,5,4]],[29,3],[35,1],[39,0]]],[0.0035496083333333328276],{"host":{"keys":["arm_cpu","cpu"],"kind":"llvm","mcpu":"apple-latest","mtriple":"arm64-apple-macos","tag":""},"keys":["metal","gpu"],"kind":"metal","max_function_args":31,"max_num_threads":256,"max_shared_memory_per_block":32768,"max_threads_per_block":256,"tag":"","thread_warp_size":32},[["TENSOR","float32",[2,4096,2560]],["TENSOR","float32",[2560,640]],["TENSOR","float32",[640]],["TENSOR","float32",[2,4096,640]],["TENSOR","float32",[2,4096,640]]]]]
[12,[[[["GetBlock",[],["T_reshape","main"],["b0"]],["GetBlock",[],["A_red_temp","main"],["b1"]],["GetBlock",[],["T_reshape_1","main"],["b2"]],["GetBlock",[],["T_reshape_2","main"],["b3"]],["GetBlock",[],["T_group_norm","main"],["b4"]],["GetBlock",[],["T_reshape_3","main"],["b5"]],["GetBlock",[],["compute","main"],["b6"]],["GetBlock",[],["T_multiply","main"],["b7"]],["GetBlock",[],["root","main"],["b8"]],["ComputeInline",["b6"],[],[]],["ComputeInline",["b5"],[],[]],["ComputeInline",["b4"],[],[]],["ComputeInline",["b3"],[],[]],["ComputeInline",["b2"],[],[]],["ComputeInline",["b0"],[],[]],["SampleCategorical",[],[[4,8,16,32,64,128,256,512],[0.125,0.125,0.125,0.125,0.125,0.125,0.125,0.125]],["v9"]],["GetLoops",["b1"],[],["l10","l11","l12","l13","l14"]],["Fuse",["l12","l13","l14"],[1],["l15"]],["Split",["l15","None","v9"],[1],["l16","l17"]],["Bind",["l17"],["threadIdx.x"],[]],["SampleCategorical",[],[[0,16,64,512,1024],[0.2000000000000000111,0.2000000000000000111,0.2000000000000000111,0.2000000000000000111,0.2000000000000000111]],["v18"]],["Annotate",["b8","v18"],["meta_schedule.unroll_explicit"],[]],["GetLoops",["b7"],[],["l19","l20","l21","l22"]],["Fuse",["l19","l20","l21","l22"],[1],["l23"]],["Split",["l23","None",256,256],[1],["l24","l25","l26"]],["Reorder",["l25","l26","l24"],[],[]],["Bind",["l25"],["blockIdx.x"],[]],["Bind",["l26"],["threadIdx.x"],[]],["GetLoops",["b1"],[],["l27","l28","l29","l30"]],["Fuse",["l27","l28"],[1],["l31"]],["Bind",["l31"],["blockIdx.x"],[]],["EnterPostproc",[],[],[]],["GetBlock",[],["root","main"],["b32"]],["Unannotate",["b32"],["meta_schedule.unroll_explicit"],[]],["GetChildBlocks",["b32"],[],["b33","b34"]],["GetLoops",["b33"],[],["l35","l36","l37"]],["Annotate",["l35",64],["pragma_auto_unroll_max_step"],[]],["Annotate",["l35",1],["pragma_unroll_explicit"],[]],["GetLoops",["b34"],[],["l38","l39","l40"]]],[[15,5],[20,2]]],[0.0027800089285714285614],{"host":{"keys":["arm_cpu","cpu"],"kind":"llvm","mcpu":"apple-latest","mtriple":"arm64-apple-macos","tag":""},"keys":["metal","gpu"],"kind":"metal","max_function_args":31,"max_num_threads":256,"max_shared_memory_per_block":32768,"max_threads_per_block":256,"tag":"","thread_warp_size":32},[["TENSOR","float32",[1,128,1024,1024]],["TENSOR","float32",[128]],["TENSOR","float32",[128]],["TENSOR","float32",[1,128,1024,1024]]]]]
